{
  "id": "gpt-4o-mini-tts",
  "provider": "openai",
  "display_name": "GPT-4o mini TTS",
  "family": "gpt-audio",
  "tier": "specialist",
  "status": "deprecated",
  "released": null,
  "retires": "2027-01-06",
  "capabilities": [
    "audio",
    "text_out"
  ],
  "context_window": null,
  "max_output_tokens": null,
  "pricing": {
    "unit": "usd_per_minute",
    "per_unit": null
  },
  "effort": {
    "parameter": null,
    "levels": [],
    "default": null
  },
  "speed": "fast",
  "fit": {
    "audio.speak": 2
  },
  "best_for": [
    "Nothing new"
  ],
  "watch_out": [
    "Shuts down 2027-01-06. Migrate to gpt-realtime-2.1-mini"
  ],
  "prompt_style": "prompt-style-openai.md",
  "prompt_tips": [
    "Migrate to gpt-realtime-2.1-mini"
  ],
  "where": [
    "api"
  ],
  "sources": [
    {
      "url": "https://developers.openai.com/api/docs/models/gpt-4o-mini-tts",
      "what": "model page"
    },
    {
      "url": "https://developers.openai.com/api/docs/pricing",
      "what": "pricing"
    },
    {
      "url": "https://developers.openai.com/api/docs/deprecations",
      "what": "shutdown dates"
    }
  ],
  "verified": "2026-10-17"
}
