{
  "id": "gpt-5.4-pro",
  "provider": "openai",
  "display_name": "GPT-5.4 Pro",
  "family": "gpt-5.4",
  "tier": "specialist",
  "status": "legacy",
  "released": "2026-03-05",
  "retires": null,
  "capabilities": [
    "text_out",
    "image_in",
    "pdf_in",
    "tool_use",
    "computer_use",
    "structured_output",
    "web_search",
    "code_execution"
  ],
  "context_window": 1050000,
  "max_output_tokens": 128000,
  "pricing": {
    "unit": "usd_per_mtok",
    "input": 30,
    "output": 180,
    "cached_input": null,
    "notes": "Over 272K input tokens the whole request is billed at 2x input / 1.5x output. Batch & Flex about 50% off; Fast tier about 2x."
  },
  "effort": {
    "parameter": "reasoning.effort",
    "levels": [
      "medium",
      "high",
      "xhigh"
    ],
    "default": "medium",
    "notes": "Responses API only."
  },
  "speed": "slow",
  "fit": {
    "reason.hard": 4,
    "research.deep": 4
  },
  "best_for": [
    "Legacy"
  ],
  "watch_out": [
    "Superseded"
  ],
  "prompt_style": "prompt-style-openai.md",
  "prompt_tips": [
    "Use GPT-6 Astra (pro mode)"
  ],
  "where": [
    "api",
    "chatgpt",
    "codex",
    "azure"
  ],
  "sources": [
    {
      "url": "https://developers.openai.com/api/docs/models/gpt-5.4-pro",
      "what": "model page: limits, price, effort levels"
    },
    {
      "url": "https://developers.openai.com/api/docs/pricing",
      "what": "pricing"
    }
  ],
  "verified": "2026-10-17"
}
